text,category
May bitak at lubak sa kalsada sa National Hwy Brgy Bagong Silang; delikado lalo na pag gabi Sana ma-actionan agad,Road Damage
Someone is dumping wastewater/sewage on Maharlika Rd. Brgy. Bayanihan; foul smell and slippery road.,Health
Stray animals roaming near chapel in Brgy. Bayanihan; risk of bites and rabies. Pls respond asap.,Health
Heavy traffic due to double parking near bridge in Brgy. San Isidro at 4:25 PM.,Traffic
Forest/brush fire near Brgy. New Era boundary; flames visible from Maharlika Rd. at 11:55 PM. thank you.,Fire
"Motorcycle with modified muffler keeps revving on JP Laurel St., Brgy. Sta. Cruz every night.",Noise
Reported burglary at National Hwy Brgy. San Isidro; window forced open 3 days ago.,Crime
"Possible dengue risk: standing water and many mosquitoes near plaza, Brgy. Bayanihan for 1 week.",Health
"Streetlight not working on Maharlika Rd., Brgy. Sta. Cruz; area is very dark at night.",Streetlight
"May nagsusunog ng basura near chapel, Brgy. Malinis around 12:40 PM; usok pumapasok sa bahay.",Garbage
Illegal dumping of mixed waste and construction debris beside the public market at Brgy. San Isidro. thank you.,Garbage
Evacuation center at elementary school Brgy. Pag-asa lacks supplies (water/blankets) last night.,Disaster
Snake spotted near canal Brgy. Bayanihan for 1 week; residents scared.,Animal Control
"May tambak na basura sa kanto ng Del Pilar St., Brgy. Riverside. Hindi pa kinukuha today. May daga na.",Garbage
"Overflowing trash bins near the barangay hall in Brgy Malinis, Mabini Ave Foul smell this morning; senior citizens complaining",Garbage
Exposed electrical wire hanging near evacuation center in Brgy San Isidro; could electrocute someone,Electricity
May naghihinalang tao paikot-ikot near terminal Brgy. Riverside 3 days ago; residents feel unsafe. Need help ASAP.,Crime
Strong winds damaged roofs in Brgy. Malinis last night; families need temporary shelter.,Disaster
Power outage in Brgy. Riverside since 4:25 PM; households cannot use appliances.,Electricity
Evacuation center at plaza Brgy. Mabini lacks supplies (water/blankets) yesterday.,Disaster
Broken lamp cover at Brgy. Pag-asa near chapel; bulb exposed and could shatter.,Streetlight
Forest/brush fire near Brgy. Pag-asa boundary; flames visible from Bonifacio Rd. at 7:00 PM.,Fire
May asong gala na nangagat sa Bonifacio Rd. Brgy. San Isidro since Monday; needs barangay action. 🔥,Animal Control
Several streetlights out along Rizal St. in Brgy. Pag-asa; please repair.,Streetlight
Stray cats and dogs tearing garbage near elementary school Brgy. San Isidro; causes mess and smell. 🚨,Animal Control
"Construction drilling starts at 8:10 AM in Brgy. Bagong Silang, Bonifacio Rd.; violates quiet hours. Sana ma-actionan agad.",Noise
May nasusunog na basura/kanal near Liberty St. Brgy. Pag-asa around 5:30 AM; strong odor and smoke.,Fire
Snake spotted near shoreline Brgy. Sta. Cruz this morning; residents scared. 😷,Animal Control
Tap water is brown/muddy in Brgy. Bagong Silang since yesterday; possible pipe contamination.,Water Supply
Uncollected garbage after market day near park in Brgy. Riverside; plastic scattered on the road. thank you.,Garbage
Faded pedestrian crossing near terminal Brgy. Malinis; drivers don't slow down.,Traffic
Internet connection down in Brgy. Pag-asa since 3 days ago; students can't attend online class.,Internet
Food stalls near public market Brgy. Pag-asa have uncovered food and flies; sanitation issue.,Health
"Motorcycle with modified muffler keeps revving on Quezon Blvd., Brgy. Pag-asa every night.",Noise
Fiber line hanging low across JP Laurel St. Brgy. Malinis; trucks might hit it. Need help ASAP.,Internet
Illegal dumping of mixed waste and construction debris beside the riverbank at Brgy Riverside,Garbage
Stray cats and dogs tearing garbage near health center Brgy. Pag-asa; causes mess and smell.,Animal Control
Power outage in Brgy. New Era since 11:55 PM; households cannot use appliances. thank you.,Electricity
"May tambak na basura sa kanto ng Rizal St., Brgy. Sta. Cruz. Hindi pa kinukuha since Monday. May daga na. 🙏",Garbage
"Motorcycle with modified muffler keeps revving on National Hwy, Brgy. Bagong Silang every night.",Noise
Bar music too loud near bridge Brgy. Mabini; windows shaking. 🚨,Noise
Snake spotted near shoreline Brgy. San Isidro since Monday; residents scared.,Animal Control
Road shoulder collapsed near Brgy. Bayanihan along National Hwy kahapon pagkatapos ng ulan; risk of accident.,Road Damage
Flickering streetlight at Bonifacio Rd. Brgy. New Era; safety concern for commuters.,Streetlight
Patay ang ilaw sa poste malapit sa elementary school Brgy. Poblacion since this morning.,Streetlight
Loud karaoke in Brgy. Malinis near covered court past 6:15 AM; kids can't sleep.,Noise
Food stalls near chapel Brgy. Bagong Silang have uncovered food and flies; sanitation issue.,Health
"Manhole cover missing on Quezon Blvd., Brgy. Bayanihan; water cannot drain properly during drizzle.",Flooding
May nag-iinuman at sobrang ingay sa Del Pilar St. Brgy. San Isidro hanggang 4:25 PM.,Noise
Drunk individuals harassing commuters near public market Brgy. Malinis at 4:25 PM.,Crime
"Motorcycle with modified muffler keeps revving on JP Laurel St, Brgy Malinis every night",Noise
"May nagsusunog ng basura near chapel, Brgy. Bayanihan around 5:30 AM; usok pumapasok sa bahay.",Garbage
Uncollected garbage after market day near elementary school in Brgy. Malinis; plastic scattered on the road.,Garbage
"Electrical sparks seen then small fire on pole near plaza, Brgy. New Era nung bagyo.",Fire
Food stalls near covered court Brgy. Bayanihan have uncovered food and flies; sanitation issue. Sana ma-actionan agad.,Health
Road shoulder collapsed near Brgy. Pag-asa along JP Laurel St. after the thunderstorm; risk of accident.,Road Damage
Forest/brush fire near Brgy. New Era boundary; flames visible from Del Pilar St. at 7:00 PM. 🙏,Fire
Frequent voltage fluctuation/brownout in Brgy. Riverside yesterday; lights flicker.,Electricity
Food stalls near elementary school Brgy. Sta. Cruz have uncovered food and flies; sanitation issue.,Health
Heavy traffic due to double parking near public market in Brgy. Bayanihan at 9:30 PM.,Traffic
Loud karaoke in Brgy. Bayanihan near riverbank past 9:30 PM; kids can't sleep.,Noise
Earthquake aftershocks reported; cracks seen at barangay hall Brgy. Sta. Cruz; request inspection.,Disaster
Internet connection down in Brgy. Pag-asa since yesterday; students can't attend online class. thank you.,Internet
Water interruption happens every morning in Brgy. Mabini; need schedule/notice. Sana ma-actionan agad.,Water Supply
"Motorcycle with modified muffler keeps revving on JP Laurel St., Brgy. Bagong Silang every night.",Noise
Fallen tree blocking Liberty St. in Brgy. New Era nung bagyo; needs clearing team.,Disaster
Illegal dumping of mixed waste and construction debris beside the terminal at Brgy. Bayanihan.,Garbage
Someone is dumping wastewater/sewage on Del Pilar St. Brgy. New Era; foul smell and slippery road.,Health
Strong winds damaged roofs in Brgy. Poblacion for 1 week; families need temporary shelter.,Disaster
Bar music too loud near evacuation center Brgy Bayanihan; windows shaking Need help ASAP,Noise
May naghihinalang tao paikot-ikot near public market Brgy. Pag-asa since Monday; residents feel unsafe. Pls respond asap.,Crime
May nasusunog na basura/kanal near Maharlika Rd. Brgy. Mabini around 6:15 AM; strong odor and smoke.,Fire
Intermittent internet: disconnects every few minutes in Brgy. Riverside especially at 11:55 PM.,Internet
Internet connection down in Brgy. Bagong Silang since today; students can't attend online class.,Internet
Snake spotted near riverbank Brgy. San Isidro for 1 week; residents scared. thank you.,Animal Control
Snake spotted near canal Brgy. Malinis today; residents scared. Sana ma-actionan agad.,Animal Control
Open trench left by roadworks near public market in Brgy. Poblacion; no warning signs.,Road Damage
"Snatching incident reported on Del Pilar St., Brgy. Bayanihan at 12:40 PM; CCTV in area should be checked. thank you. 🔥",Crime
Kitchen fire at a stall near public market Brgy. Malinis; needs inspection of LPG safety.,Fire
No water supply in Brgy. San Isidro since 6:15 AM; residents cannot store water.,Water Supply
Faded pedestrian crossing near covered court Brgy. Mabini; drivers don't slow down.,Traffic
Baha sa tapat ng evacuation center Brgy. Bagong Silang at 9:30 PM; vehicles cannot pass safely.,Flooding
Open manhole on Maharlika Rd. Brgy. Sta. Cruz near riverbank; very dangerous at night.,Public Safety
Earthquake aftershocks reported; cracks seen at riverbank Brgy New Era; request inspection,Disaster
May bitak at lubak sa kalsada sa Liberty St. Brgy. Bagong Silang; delikado lalo na pag gabi.,Road Damage
Transformer humming loudly and smells burnt near JP Laurel St. Brgy. San Isidro; possible overload.,Electricity
Faded pedestrian crossing near health center Brgy Riverside; drivers don't slow down,Traffic
Evacuation center at chapel Brgy. New Era lacks supplies (water/blankets) last night. 🚨,Disaster
May bitak at lubak sa kalsada sa Sampaguita St. Brgy. Sta. Cruz; delikado lalo na pag gabi. Pls respond asap.,Road Damage
Dead animal (dog/cat) on Rizal St. Brgy. Pag-asa; needs proper disposal to avoid disease. 🙏,Animal Control
"Construction drilling starts at 9:30 PM in Brgy. San Isidro, Liberty St.; violates quiet hours.",Noise
Patay ang ilaw sa poste malapit sa elementary school Brgy. San Isidro since since Monday. Pls respond asap.,Streetlight
"Electrical sparks seen then small fire on pole near park, Brgy. Pag-asa tuwing malakas ang ulan. Pls respond asap.",Fire
Motorcycle theft attempt near terminal in Brgy. Malinis last night; please increase patrol.,Crime
"Low water pressure on Maharlika Rd., Brgy. Sta. Cruz 3 days ago; tap only drips. Sana ma-actionan agad.",Water Supply
Heavy traffic due to double parking near elementary school in Brgy Sta Cruz at 6:15 AM,Traffic
Internet connection down in Brgy. Malinis since last night; students can't attend online class.,Internet
"Knee-deep floodwater after heavy rain along Maharlika Rd., Brgy. Poblacion. Drainage clogged with leaves and plastic.",Flooding
Snake spotted near creek Brgy. San Isidro yesterday; residents scared.,Animal Control
Drunk individuals harassing commuters near chapel Brgy. Pag-asa at 11:55 PM.,Crime
Power outage in Brgy. San Isidro since 4:25 PM; households cannot use appliances.,Electricity
Exposed electrical wire hanging near public market in Brgy. Pag-asa; could electrocute someone. thank you.,Electricity
Fallen tree blocking Liberty St. in Brgy. Bayanihan after the thunderstorm; needs clearing team.,Disaster
Road shoulder collapsed near Brgy. San Isidro along Rizal St. after the thunderstorm; risk of accident.,Road Damage
Forest/brush fire near Brgy San Isidro boundary; flames visible from National Hwy at 9:30 PM,Fire
No traffic enforcer at intersection of Quezon Blvd. in Brgy. San Isidro; near-misses happening.,Traffic
Flickering streetlight at Sampaguita St. Brgy. New Era; safety concern for motorists.,Streetlight
Food stalls near chapel Brgy. Bagong Silang have uncovered food and flies; sanitation issue.,Health
May nasusunog na basura/kanal near Sampaguita St. Brgy. Bagong Silang around 9:30 PM; strong odor and smoke.,Fire
"Manhole cover missing on Rizal St, Brgy Riverside; water cannot drain properly after heavy rain",Flooding
Stray cats and dogs tearing garbage near riverbank Brgy. Bagong Silang; causes mess and smell.,Animal Control
Stray cats and dogs tearing garbage near evacuation center Brgy. San Isidro; causes mess and smell.,Animal Control
Bar music too loud near bridge Brgy. Bayanihan; windows shaking.,Noise
Reported suspected food poisoning after eating at barangay hall Brgy Mabini today; several vendors got sick,Health
"Snatching incident reported on Mabini Ave., Brgy. Poblacion at 8:10 AM; CCTV in area should be checked. 😷",Crime
Dead animal (dog/cat) on National Hwy Brgy. Bagong Silang; needs proper disposal to avoid disease.,Animal Control
Evacuation center at health center Brgy. San Isidro lacks supplies (water/blankets) yesterday.,Disaster
"Snatching incident reported on Liberty St., Brgy. Pag-asa at 4:25 PM; CCTV in area should be checked.",Crime
Reported suspected food poisoning after eating at park Brgy. Pag-asa this morning; several residents got sick. thank you.,Health
Fallen tree blocking JP Laurel St. in Brgy. Riverside after the thunderstorm; needs clearing team.,Disaster
No water supply in Brgy. Malinis since 6:15 AM; residents cannot store water.,Water Supply
Water interruption happens every morning in Brgy. Poblacion; need schedule/notice.,Water Supply
Stray cats and dogs tearing garbage near terminal Brgy. Sta. Cruz; causes mess and smell.,Animal Control
"Power pole leaning dangerously on National Hwy, Brgy. Pag-asa; might fall nung bagyo.",Electricity
Grass fire reported near riverbank in Brgy. Riverside since Monday; smoke reducing visibility on Rizal St..,Fire
May nasusunog na basura/kanal near Bonifacio Rd. Brgy. Mabini around 11:55 PM; strong odor and smoke.,Fire
Open trench left by roadworks near health center in Brgy. Pag-asa; no warning signs. 🚨,Road Damage
Dead animal (dog/cat) on Mabini Ave. Brgy. Malinis; needs proper disposal to avoid disease.,Animal Control
"Broken sidewalk tiles near terminal, Brgy. Mabini; pedestrians keep tripping.",Road Damage
Someone is dumping wastewater/sewage on Rizal St. Brgy. Malinis; foul smell and slippery road.,Health
Road shoulder collapsed near Brgy. Bagong Silang along Rizal St. kahapon pagkatapos ng ulan; risk of accident.,Road Damage
Water leak from main pipe near health center Brgy. Sta. Cruz; water wasted and road flooded.,Water Supply
Internet connection down in Brgy. Mabini since last night; students can't attend online class. 🔥,Internet
Several streetlights out along Del Pilar St. in Brgy. Riverside; please repair.,Streetlight
"Tricycles loading/unloading in the middle of Maharlika Rd., Brgy. Mabini; causes congestion.",Traffic
"Possible dengue risk: standing water and many mosquitoes near riverbank, Brgy. Poblacion 3 days ago. Need help ASAP.",Health
"Low water pressure on Rizal St., Brgy. Malinis today; tap only drips.",Water Supply
"May nagsusunog ng basura near public market, Brgy. Pag-asa around 12:40 PM; usok pumapasok sa bahay. 😷",Garbage
Frequent voltage fluctuation/brownout in Brgy. Mabini yesterday; lights flicker.,Electricity
Power outage in Brgy. San Isidro since 11:55 PM; households cannot use appliances. Sana ma-actionan agad.,Electricity
Motorcycle theft attempt near park in Brgy. Malinis last night; please increase patrol.,Crime
May naghihinalang tao paikot-ikot near public market Brgy Pag-asa today; residents feel unsafe,Crime
Strong winds damaged roofs in Brgy. New Era this morning; families need temporary shelter.,Disaster
Uncovered well/pit near Brgy. Riverside houses; children at risk. Sana ma-actionan agad.,Public Safety
"Power pole leaning dangerously on Sampaguita St., Brgy. New Era; might fall after heavy rain.",Electricity
Drunk individuals harassing commuters near public market Brgy. San Isidro at 6:15 AM.,Crime
May asong gala na nangagat sa JP Laurel St Brgy Riverside today; needs barangay action,Animal Control
"Standing water in front of plaza, Brgy. San Isidro this morning; possible mosquito breeding.",Flooding
"May tambak na basura sa kanto ng Sampaguita St., Brgy. Malinis. Hindi pa kinukuha yesterday. May daga na.",Garbage
"Knee-deep floodwater after heavy rain along Sampaguita St., Brgy. Malinis. Drainage clogged with leaves and plastic.",Flooding
Pack of stray dogs near park in Brgy. Malinis 12:40 PM; chased children.,Animal Control
Baradong kanal sa Bonifacio Rd. Brgy. New Era; umaapaw kahapon pagkatapos ng ulan and water enters houses. Sana ma-actionan agad. 🚨,Flooding
Frequent voltage fluctuation/brownout in Brgy. Riverside yesterday; lights flicker.,Electricity
Several streetlights out along JP Laurel St. in Brgy. Malinis; please repair. Sana ma-actionan agad. 😷,Streetlight
"Low water pressure on Maharlika Rd., Brgy. San Isidro since yesterday; tap only drips. Sana ma-actionan agad.",Water Supply
Illegal dumping of mixed waste and construction debris beside the barangay hall at Brgy. Poblacion.,Garbage
Heavy traffic due to double parking near terminal in Brgy. Poblacion at 9:30 PM.,Traffic
"Broken sidewalk tiles near health center, Brgy Sta Cruz; pedestrians keep tripping",Road Damage
Evacuation center at riverbank Brgy. New Era lacks supplies (water/blankets) this morning.,Disaster
May naghihinalang tao paikot-ikot near public market Brgy. Riverside for 1 week; residents feel unsafe. Sana ma-actionan agad.,Crime
"Motorcycle with modified muffler keeps revving on Bonifacio Rd., Brgy. Malinis every night.",Noise
Baradong kanal sa Bonifacio Rd. Brgy. Mabini; umaapaw kahapon pagkatapos ng ulan and water enters houses.,Flooding
Power outage in Brgy. San Isidro since 8:10 AM; households cannot use appliances.,Electricity
"Power pole leaning dangerously on Rizal St., Brgy. Riverside; might fall tuwing malakas ang ulan. thank you.",Electricity
Exposed electrical wire hanging near plaza in Brgy. Riverside; could electrocute someone. thank you.,Electricity
Faded pedestrian crossing near plaza Brgy. Bagong Silang; drivers don't slow down.,Traffic
Bar music too loud near park Brgy. Bagong Silang; windows shaking.,Noise
Blocked fire exit/escape route near chapel Brgy. Mabini; please enforce safety. 😷,Public Safety
Strong winds damaged roofs in Brgy. Bagong Silang since Monday; families need temporary shelter.,Disaster
Reported burglary at Quezon Blvd. Brgy. Bagong Silang; window forced open this morning. thank you. 🚨,Crime
"Motorcycle with modified muffler keeps revving on Del Pilar St., Brgy. Malinis every night.",Noise
May nasusunog na basura/kanal near Quezon Blvd. Brgy. Sta. Cruz around 8:10 AM; strong odor and smoke.,Fire
"Large pothole on Mabini Ave., Brgy. Bagong Silang; a motorcycle almost crashed yesterday. Needs patching. Sana ma-actionan agad.",Road Damage
Fiber line hanging low across Rizal St. Brgy. San Isidro; trucks might hit it. Pls respond asap.,Internet
"Knee-deep floodwater during drizzle along Quezon Blvd., Brgy. Mabini. Drainage clogged with leaves and plastic.",Flooding
Tap water is brown/muddy in Brgy. Poblacion 3 days ago; possible pipe contamination.,Water Supply
Intermittent internet: disconnects every few minutes in Brgy. Poblacion especially at 4:25 PM.,Internet
Drunk individuals harassing commuters near health center Brgy. Malinis at 4:25 PM.,Crime
Reported burglary at Quezon Blvd. Brgy. Poblacion; window forced open since Monday.,Crime
Forest/brush fire near Brgy. Sta. Cruz boundary; flames visible from Del Pilar St. at 5:30 AM. Sana ma-actionan agad.,Fire
Blocked fire exit/escape route near bridge Brgy. San Isidro; please enforce safety.,Public Safety
Flickering streetlight at Sampaguita St. Brgy. Malinis; safety concern for senior citizens. Pls respond asap.,Streetlight
Forest/brush fire near Brgy. Poblacion boundary; flames visible from Liberty St. at 9:30 PM.,Fire
"Low water pressure on National Hwy, Brgy. Riverside today; tap only drips. 🔥",Water Supply
"Motorcycle with modified muffler keeps revving on Bonifacio Rd., Brgy. Poblacion every night.",Noise
Reported burglary at Rizal St. Brgy. Pag-asa; window forced open for 1 week. Sana ma-actionan agad.,Crime
"Streetlight not working on JP Laurel St., Brgy. San Isidro; area is very dark at night.",Streetlight
Snake spotted near creek Brgy. Riverside for 1 week; residents scared.,Animal Control
"Overflowing trash bins near the plaza in Brgy. San Isidro, Mabini Ave.. Foul smell this morning; vendors complaining.",Garbage
Uncovered well/pit near Brgy. Bagong Silang houses; children at risk. 🚨,Public Safety
Intermittent internet: disconnects every few minutes in Brgy. Bagong Silang especially at 12:40 PM. thank you.,Internet
Loose hanging cables across Rizal St. Brgy. New Era; could snag vehicles.,Public Safety
Stray cats and dogs tearing garbage near health center Brgy. Bayanihan; causes mess and smell. thank you.,Animal Control
Reported burglary at Liberty St. Brgy. Poblacion; window forced open since Monday.,Crime
Patay ang ilaw sa poste malapit sa elementary school Brgy. Pag-asa since yesterday. Need help ASAP.,Streetlight
"Low water pressure on Quezon Blvd., Brgy. Bayanihan last night; tap only drips. Need help ASAP.",Water Supply
Broken footbridge/handrail near bridge Brgy Pag-asa; risk of falling,Public Safety
"Standing water in front of health center, Brgy. Poblacion since yesterday; possible mosquito breeding.",Flooding
"Knee-deep floodwater nung bagyo along Rizal St., Brgy. Bagong Silang. Drainage clogged with leaves and plastic.",Flooding
Stray cats and dogs tearing garbage near elementary school Brgy. Poblacion; causes mess and smell.,Animal Control
Stray cats and dogs tearing garbage near elementary school Brgy. Poblacion; causes mess and smell.,Animal Control
"Streetlight not working on Liberty St., Brgy. New Era; area is very dark at night. thank you.",Streetlight
"Standing water in front of bridge, Brgy. New Era yesterday; possible mosquito breeding.",Flooding
Water interruption happens every morning in Brgy. Bagong Silang; need schedule/notice.,Water Supply
Bar music too loud near park Brgy. Malinis; windows shaking.,Noise
"Knee-deep floodwater during drizzle along Liberty St., Brgy. Mabini. Drainage clogged with leaves and plastic. Need help ASAP.",Flooding
Loud karaoke in Brgy. San Isidro near evacuation center past 12:40 PM; kids can't sleep. Need help ASAP.,Noise
Broken footbridge/handrail near plaza Brgy. Sta. Cruz; risk of falling.,Public Safety
"May nagsusunog ng basura near evacuation center, Brgy. San Isidro around 8:10 AM; usok pumapasok sa bahay. thank you.",Garbage
Exposed electrical wire hanging near bridge in Brgy. Mabini; could electrocute someone. 🙏,Electricity
Pack of stray dogs near riverbank in Brgy. Pag-asa 9:30 PM; chased children. Sana ma-actionan agad.,Animal Control
Flickering streetlight at Bonifacio Rd. Brgy. Malinis; safety concern for commuters.,Streetlight
Exposed electrical wire hanging near elementary school in Brgy. Bagong Silang; could electrocute someone.,Electricity
Open manhole on Quezon Blvd. Brgy. Poblacion near elementary school; very dangerous at night. Need help ASAP.,Public Safety
Blocked fire exit/escape route near public market Brgy. San Isidro; please enforce safety.,Public Safety
Transformer humming loudly and smells burnt near Mabini Ave. Brgy. Riverside; possible overload. 🙏,Electricity
Kitchen fire at a stall near park Brgy. San Isidro; needs inspection of LPG safety.,Fire
Baha sa tapat ng riverbank Brgy. Sta. Cruz at 4:25 PM; vehicles cannot pass safely. 😟,Flooding
Kitchen fire at a stall near bridge Brgy. Poblacion; needs inspection of LPG safety.,Fire
"Electrical sparks seen then small fire on pole near covered court, Brgy. New Era after heavy rain.",Fire
"Possible dengue risk: standing water and many mosquitoes near covered court, Brgy. San Isidro since Monday.",Health
Snake spotted near canal Brgy San Isidro yesterday; residents scared,Animal Control
"Motorcycle with modified muffler keeps revving on Sampaguita St., Brgy. Poblacion every night.",Noise
Broken footbridge/handrail near evacuation center Brgy. New Era; risk of falling.,Public Safety
"Broken sidewalk tiles near health center, Brgy. Malinis; pedestrians keep tripping. 🔥",Road Damage
Water leak from main pipe near bridge Brgy. Bagong Silang; water wasted and road flooded.,Water Supply
Illegal dumping of mixed waste and construction debris beside the plaza at Brgy. Mabini.,Garbage
Broken footbridge/handrail near chapel Brgy. Sta. Cruz; risk of falling.,Public Safety
Open trench left by roadworks near covered court in Brgy. Bayanihan; no warning signs.,Road Damage
May nag-iinuman at sobrang ingay sa National Hwy Brgy. Pag-asa hanggang 9:30 PM.,Noise
Bar music too loud near evacuation center Brgy. Pag-asa; windows shaking.,Noise
Loud karaoke in Brgy. Pag-asa near park past 4:25 PM; kids can't sleep. Pls respond asap.,Noise
"Construction drilling starts at 7:00 PM in Brgy. Mabini, Del Pilar St.; violates quiet hours.",Noise
Bar music too loud near park Brgy. Poblacion; windows shaking.,Noise
Loose hanging cables across Rizal St. Brgy. Riverside; could snag vehicles.,Public Safety
Flickering streetlight at Rizal St. Brgy. Bagong Silang; safety concern for residents.,Streetlight
Earthquake aftershocks reported; cracks seen at park Brgy Bayanihan; request inspection Pls respond asap,Disaster
Baradong kanal sa Quezon Blvd. Brgy. Bagong Silang; umaapaw kahapon pagkatapos ng ulan and water enters houses.,Flooding
Exposed electrical wire hanging near public market in Brgy. New Era; could electrocute someone. Sana ma-actionan agad.,Electricity
"Tricycles loading/unloading in the middle of JP Laurel St., Brgy. Mabini; causes congestion.",Traffic
"Illegal vendors blocking one lane on Quezon Blvd., Brgy. Bayanihan; cars stuck and honking. Pls respond asap.",Traffic
"Manhole cover missing on Mabini Ave, Brgy Riverside; water cannot drain properly tuwing malakas ang ulan",Flooding
Snake spotted near creek Brgy. Malinis for 1 week; residents scared. Sana ma-actionan agad.,Animal Control
May naghihinalang tao paikot-ikot near elementary school Brgy. San Isidro for 1 week; residents feel unsafe.,Crime
Fiber line hanging low across National Hwy Brgy. Pag-asa; trucks might hit it.,Internet
May nasusunog na basura/kanal near JP Laurel St Brgy Poblacion around 9:30 PM; strong odor and smoke,Fire
"Streetlight not working on Sampaguita St, Brgy Malinis; area is very dark at night",Streetlight
Open trench left by roadworks near park in Brgy. Bayanihan; no warning signs.,Road Damage
