text,category
May nasusunog na basura/kanal near JP Laurel St. Brgy. Mabini around 5:30 AM; strong odor and smoke.,Fire
Uncollected garbage after market day near park in Brgy. San Isidro; plastic scattered on the road. Pls respond asap.,Garbage
Grass fire reported near public market in Brgy. Pag-asa since Monday; smoke reducing visibility on JP Laurel St..,Fire
Stray cats and dogs tearing garbage near riverbank Brgy. Malinis; causes mess and smell. Pls respond asap.,Animal Control
Stray cats and dogs tearing garbage near barangay hall Brgy. Sta. Cruz; causes mess and smell.,Animal Control
Grass fire reported near elementary school in Brgy. Pag-asa 3 days ago; smoke reducing visibility on Rizal St..,Fire
Frequent voltage fluctuation/brownout in Brgy. Mabini this morning; lights flicker.,Electricity
May bitak at lubak sa kalsada sa JP Laurel St. Brgy. Poblacion; delikado lalo na pag gabi.,Road Damage
Broken lamp cover at Brgy. Riverside near chapel; bulb exposed and could shatter.,Streetlight
Uncollected garbage after market day near covered court in Brgy. Bayanihan; plastic scattered on the road.,Garbage
Grass fire reported near plaza in Brgy. Riverside this morning; smoke reducing visibility on Del Pilar St..,Fire
Several streetlights out along National Hwy in Brgy. Bagong Silang; pls repair. Sana ma-actionan agad.,Streetlight
Flickering streetlight at Sampaguita St Brgy Bayanihan; safety concern for children,Streetlight
"Tricycles loading/unloading in the middle of Sampaguita St., Brgy. Mabini; causes congestion.",Traffic
"Overflowing trash bins near the barangay hall in Brgy San Isidro, Del Pilar St Foul smell 3 days ago; residents complaining",Garbage
Minor landslide/soil erosion near Brgy. Mabini roadside on Del Pilar St. nung bagyo.,Disaster
"Overflowing trash bins near the health center in Brgy. Pag-asa, Maharlika Rd.. Foul smell since Monday; residents complaining. Sana ma-actionan agad.",Garbage
Uncollected garbage after market day near bridge in Brgy. Malinis; plastic scattered on the road.,Garbage
Stray animals roaming near terminal in Brgy. San Isidro; risk of bites and rabies.,Health
Patay ang ilaw sa poste malapit sa bridge Brgy. Pag-asa since today.,Streetlight
Uncovered well/pit near Brgy. Pag-asa houses; children at risk. Pls respond asap.,Public Safety
No water supply in Brgy. New Era since 8:10 AM; residents cannot store water.,Water Supply
No water supply in Brgy. Riverside since 7:00 PM; residents cannot store water.,Water Supply
Fallen tree blocking Sampaguita St. in Brgy. Pag-asa after the thunderstorm; needs clearing team. Pls respond asap.,Disaster
May nasusunog na basura/kanal near Quezon Blvd. Brgy. Sta. Cruz around 4:25 PM; strong odor and smoke.,Fire
"Low water pressure on Del Pilar St., Brgy. Bagong Silang since Monday; tap only drips. Need help ASAP.",Water Supply
Intermittent internet: disconnects every few minutes in Brgy. Bayanihan especially at 6:15 AM. Sana ma-actionan agad.,Internet
Stray cats and dogs tearing garbage near terminal Brgy. Sta. Cruz; causes mess and smell.,Animal Control
"Standing water in front of park, Brgy. New Era for 1 week; possible mosquito breeding. 🙏",Flooding
Forest/brush fire near Brgy. Sta. Cruz boundary; flames visible from Mabini Ave. at 5:30 AM.,Fire
Bar music too loud near plaza Brgy. New Era; windows shaking.,Noise
Water interruption happens every morning in Brgy. Bagong Silang; need schedule/notice.,Water Supply
Community WiFi at barangay hall Brgy. Riverside not working since Monday; router keeps rebooting.,Internet
Bar music too loud near evacuation center Brgy. Malinis; windows shaking.,Noise
"May nagsusunog ng basura near health center, Brgy. Bayanihan around 6:15 AM; usok pumapasok sa bahay.",Garbage
Kitchen fire at a stall near park Brgy. Poblacion; needs inspection of LPG safety.,Fire
Stray animals roaming near riverbank in Brgy. San Isidro; risk of bites and rabies.,Health
Patay ang ilaw sa poste malapit sa health center Brgy. Pag-asa since yesterday. thank you.,Streetlight
May nag-iinuman at sobrang ingay sa Bonifacio Rd. Brgy. Poblacion hanggang 8:10 AM.,Noise
"Standing water in front of riverbank, Brgy. Poblacion for 1 week; possible mosquito breeding.",Flooding
Patay ang ilaw sa poste malapit sa evacuation center Brgy Mabini since last night 🔥,Streetlight
Food stalls near plaza Brgy. Sta. Cruz have uncovered food and flies; sanitation issue.,Health
Uncollected garbage after market day near public market in Brgy. Bayanihan; plastic scattered on the road. 🔥,Garbage
Strong winds damaged roofs in Brgy San Isidro yesterday; families need temporary shelter Pls respond asap,Disaster
Patay ang ilaw sa poste malapit sa riverbank Brgy. Sta. Cruz since yesterday.,Streetlight
Tap water is brown/muddy in Brgy. San Isidro 3 days ago; possible pipe contamination.,Water Supply
Grass fire reported near public market in Brgy. Bayanihan today; smoke reducing visibility on National Hwy.,Fire
Transformer humming loudly and smells burnt near Quezon Blvd. Brgy. Mabini; possible overload.,Electricity
Reported burglary at JP Laurel St. Brgy. Riverside; window forced open this morning.,Crime
Someone is dumping wastewater/sewage on Sampaguita St. Brgy. New Era; foul smell and slippery road.,Health
Intermittent internet: disconnects every few minutes in Brgy. Bayanihan especially at 4:25 PM.,Internet
Motorcycle theft attempt near plaza in Brgy. Bayanihan last night; please increase patrol.,Crime
Power outage in Brgy. Sta. Cruz since 4:25 PM; households cannot use appliances.,Electricity
Reported suspected food poisoning after eating at terminal Brgy. Bayanihan last night; several commuters got sick.,Health
Reported burglary at Quezon Blvd. Brgy. New Era; window forced open this morning.,Crime
Faded pedestrian crossing near terminal Brgy. New Era; drivers don't slow down. Sana ma-actionan agad.,Traffic
Exposed electrical wire hanging near park in Brgy. San Isidro; could electrocute someone.,Electricity
Motorcycle theft attempt near covered court in Brgy. Sta. Cruz last night; please increase patrol.,Crime
Earthquake aftershocks reported; cracks seen at covered court Brgy. Mabini; request inspection. 🙏,Disaster
Broken lamp cover at Brgy. New Era near public market; bulb exposed and could shatter.,Streetlight
Kitchen fire at a stall near elementary school Brgy. San Isidro; needs inspection of LPG safety.,Fire
Flickering streetlight at Del Pilar St. Brgy. Sta. Cruz; safety concern for children.,Streetlight
Reported suspected food poisoning after eating at plaza Brgy. Bagong Silang yesterday; several senior citizens got sick.,Health
Snake spotted near creek Brgy. Pag-asa 3 days ago; residents scared.,Animal Control
Dead animal (dog/cat) on Liberty St. Brgy. Sta. Cruz; needs proper disposal to avoid disease.,Animal Control
"Overflowing trash bins near the park in Brgy. Pag-asa, Rizal St.. Foul smell this morning; vendors complaining. Sana ma-actionan agad.",Garbage
"Snatching incident reported on JP Laurel St., Brgy. New Era at 9:30 PM; CCTV in area should be checked.",Crime
"Possible dengue risk: standing water and many mosquitoes near elementary school, Brgy. Malinis since yesterday.",Health
Several streetlights out along Quezon Blvd. in Brgy. Sta. Cruz; please repair.,Streetlight
"Snatching incident reported on Mabini Ave, Brgy San Isidro at 9:30 PM; CCTV in area should be checked",Crime
Broken footbridge/handrail near plaza Brgy. New Era; risk of falling.,Public Safety
No traffic enforcer at intersection of National Hwy in Brgy. Mabini; near-misses happening.,Traffic
Road shoulder collapsed near Brgy. Pag-asa along Mabini Ave. kahapon pagkatapos ng ulan; risk of accident.,Road Damage
Heavy traffic due to double parking near public market in Brgy. Malinis at 5:30 AM. Need help ASAP.,Traffic
Community WiFi at riverbank Brgy. Bayanihan not working since yesterday; router keeps rebooting. thank you.,Internet
Frequent voltage fluctuation/brownout in Brgy. Mabini yesterday; lights flicker.,Electricity
Faded pedestrian crossing near terminal Brgy. Bagong Silang; drivers don't slow down.,Traffic
Road shoulder collapsed near Brgy. Poblacion along Sampaguita St. after heavy rain; risk of accident. Need help ASAP.,Road Damage
Fallen tree blocking Mabini Ave. in Brgy. New Era kahapon pagkatapos ng ulan; needs clearing team.,Disaster
Dead animal (dog/cat) on Del Pilar St. Brgy. Sta. Cruz; needs proper disposal to avoid disease. thank you.,Animal Control
Frequent voltage fluctuation/brownout in Brgy. Mabini last night; lights flicker.,Electricity
"Tricycles loading/unloading in the middle of Sampaguita St., Brgy. Mabini; causes congestion.",Traffic
May nag-iinuman at sobrang ingay sa Quezon Blvd. Brgy. Bagong Silang hanggang 11:55 PM.,Noise
Stray cats and dogs tearing garbage near bridge Brgy. New Era; causes mess and smell.,Animal Control
Loose hanging cables across National Hwy Brgy. San Isidro; could snag vehicles.,Public Safety
Community WiFi at evacuation center Brgy. Sta. Cruz not working 3 days ago; router keeps rebooting.,Internet
Motorcycle theft attempt near elementary school in Brgy. Riverside last night; pls increase patrol.,Crime
Stray cats and dogs tearing garbage near health center Brgy. Bagong Silang; causes mess and smell.,Animal Control
Uncollected garbage after market day near evacuation center in Brgy. Pag-asa; plastic scattered on the road. 😟,Garbage
Reported suspected food poisoning after eating at health center Brgy. Riverside since Monday; several senior citizens got sick. Sana ma-actionan agad.,Health
Water interruption happens every morning in Brgy. Bayanihan; need schedule/notice. Pls respond asap.,Water Supply
Patay ang ilaw sa poste malapit sa health center Brgy. Bayanihan since yesterday. Pls respond asap.,Streetlight
"Standing water in front of evacuation center, Brgy. Bagong Silang this morning; possible mosquito breeding. Sana ma-actionan agad.",Flooding
Illegal dumping of mixed waste and construction debris beside the covered court at Brgy. Poblacion.,Garbage
"Snatching incident reported on Quezon Blvd., Brgy. Pag-asa at 12:40 PM; CCTV in area should be checked. Pls respond asap.",Crime
Minor landslide/soil erosion near Brgy. Sta. Cruz roadside on Maharlika Rd. after heavy rain.,Disaster
Food stalls near evacuation center Brgy. Bagong Silang have uncovered food and flies; sanitation issue.,Health
Food stalls near riverbank Brgy. Bayanihan have uncovered food and flies; sanitation issue. 🔥,Health
"Tricycles loading/unloading in the middle of Quezon Blvd., Brgy. Bagong Silang; causes congestion.",Traffic
Kitchen fire at a stall near terminal Brgy. New Era; needs inspection of LPG safety.,Fire
Uncovered well/pit near Brgy. Sta. Cruz houses; children at risk. thank you.,Public Safety
"Illegal vendors blocking one lane on Del Pilar St., Brgy. Pag-asa; cars stuck and honking. Pls respond asap.",Traffic
Exposed electrical wire hanging near public market in Brgy Pag-asa; could electrocute someone 🙏,Electricity
Internet connection down in Brgy. Sta. Cruz since since Monday; students can't attend online class. 😷,Internet
"Illegal vendors blocking one lane on National Hwy, Brgy. New Era; cars stuck and honking.",Traffic
"Power pole leaning dangerously on Mabini Ave., Brgy. San Isidro; might fall tuwing malakas ang ulan.",Electricity
Open trench left by roadworks near evacuation center in Brgy. Mabini; no warning signs.,Road Damage
"Snatching incident reported on National Hwy, Brgy. Poblacion at 8:10 AM; CCTV in area should be checked.",Crime
No water supply in Brgy. New Era since 5:30 AM; residents cannot store water.,Water Supply
"May nagsusunog ng basura near bridge, Brgy. Malinis around 4:25 PM; usok pumapasok sa bahay.",Garbage
Uncovered well/pit near Brgy. Bayanihan houses; children at risk.,Public Safety
Illegal dumping of mixed waste and construction debris beside the public market at Brgy. Riverside. Pls respond asap.,Garbage
Bar music too loud near barangay hall Brgy. Pag-asa; windows shaking.,Noise
"Power pole leaning dangerously on Quezon Blvd., Brgy. Riverside; might fall nung bagyo.",Electricity
Baradong kanal sa Mabini Ave Brgy Riverside; umaapaw kahapon pagkatapos ng ulan and water enters houses,Flooding
Uncovered well/pit near Brgy Sta Cruz houses; children at risk,Public Safety
Loose hanging cables across Bonifacio Rd. Brgy. Sta. Cruz; could snag vehicles.,Public Safety
Heavy traffic due to double parking near terminal in Brgy. Riverside at 5:30 AM.,Traffic
Community WiFi at covered court Brgy. Poblacion not working since Monday; router keeps rebooting.,Internet
"Snatching incident reported on Sampaguita St., Brgy. Sta. Cruz at 6:15 AM; CCTV in area should be checked. thank you.",Crime
Strong winds damaged roofs in Brgy. San Isidro since Monday; families need temporary shelter.,Disaster
Blocked fire exit/escape route near covered court Brgy. Malinis; please enforce safety.,Public Safety
"Broken sidewalk tiles near terminal, Brgy. Pag-asa; pedestrians keep tripping.",Road Damage
Pack of stray dogs near health center in Brgy. Pag-asa 8:10 AM; chased children.,Animal Control
Snake spotted near shoreline Brgy. Poblacion for 1 week; residents scared. Pls respond asap.,Animal Control
Broken lamp cover at Brgy. Bagong Silang near park; bulb exposed and could shatter.,Streetlight
Exposed electrical wire hanging near riverbank in Brgy. New Era; could electrocute someone.,Electricity
"Snatching incident reported on Bonifacio Rd., Brgy. Bayanihan at 11:55 PM; CCTV in area should be checked.",Crime
Faded pedestrian crossing near chapel Brgy Bayanihan; drivers don't slow down,Traffic
Open trench left by roadworks near chapel in Brgy. Pag-asa; no warning signs.,Road Damage
"Construction drilling starts at 12:40 PM in Brgy. Sta. Cruz, Del Pilar St.; violates quiet hours.",Noise
"Illegal vendors blocking one lane on Quezon Blvd., Brgy. Sta. Cruz; cars stuck and honking. Pls respond asap.",Traffic
Someone is dumping wastewater/sewage on Rizal St. Brgy. San Isidro; foul smell and slippery road.,Health
Motorcycle theft attempt near park in Brgy San Isidro last night; please increase patrol Need help ASAP,Crime
Baradong kanal sa Maharlika Rd. Brgy. Sta. Cruz; umaapaw kahapon pagkatapos ng ulan and water enters houses.,Flooding
"Power pole leaning dangerously on Sampaguita St., Brgy. Mabini; might fall nung bagyo.",Electricity
"Possible dengue risk: standing water and many mosquitoes near bridge, Brgy. Riverside this morning. Need help ASAP.",Health
Fallen tree blocking Rizal St. in Brgy. Sta. Cruz during drizzle; needs clearing team.,Disaster
"Snatching incident reported on Mabini Ave., Brgy. Pag-asa at 6:15 AM; CCTV in area should be checked.",Crime
Patay ang ilaw sa poste malapit sa bridge Brgy. Bayanihan since since Monday.,Streetlight
"Construction drilling starts at 4:25 PM in Brgy. New Era, Liberty St.; violates quiet hours. Pls respond asap.",Noise
Baradong kanal sa Mabini Ave. Brgy. Riverside; umaapaw tuwing malakas ang ulan and water enters houses. 🔥,Flooding
Patay ang ilaw sa poste malapit sa bridge Brgy. Bagong Silang since this morning.,Streetlight
"Motorcycle with modified muffler keeps revving on Quezon Blvd., Brgy. Riverside every night.",Noise
Dead animal (dog/cat) on Del Pilar St. Brgy. San Isidro; needs proper disposal to avoid disease.,Animal Control
Loud karaoke in Brgy. San Isidro near terminal past 5:30 AM; kids can't sleep.,Noise
Snake spotted near shoreline Brgy. San Isidro since yesterday; residents scared. Need help ASAP.,Animal Control
Loud karaoke in Brgy. Sta. Cruz near chapel past 8:10 AM; kids can't sleep. Sana ma-actionan agad.,Noise
"Power pole leaning dangerously on Bonifacio Rd., Brgy. Mabini; might fall during drizzle. 😷",Electricity
"Electrical sparks seen then small fire on pole near public market, Brgy. Sta. Cruz during drizzle.",Fire
Intermittent internet: disconnects every few minutes in Brgy. Malinis especially at 11:55 PM.,Internet
May asong gala na nangagat sa Quezon Blvd. Brgy. Poblacion since yesterday; needs barangay action.,Animal Control
Strong winds damaged roofs in Brgy. Bayanihan today; families need temporary shelter.,Disaster
Snake spotted near canal Brgy. Poblacion last night; residents scared.,Animal Control
Stray cats and dogs tearing garbage near park Brgy. Pag-asa; causes mess and smell. 🚨,Animal Control
"Low water pressure on Mabini Ave., Brgy. Sta. Cruz yesterday; tap only drips.",Water Supply
"Large pothole on Liberty St., Brgy. San Isidro; a motorcycle almost crashed 3 days ago. Needs patching.",Road Damage
Drunk individuals harassing commuters near park Brgy. Bayanihan at 8:10 AM. Sana ma-actionan agad.,Crime
Loose hanging cables across National Hwy Brgy. Bayanihan; could snag vehicles. Sana ma-actionan agad.,Public Safety
Flickering streetlight at Del Pilar St. Brgy. Poblacion; safety concern for residents.,Streetlight
Pack of stray dogs near plaza in Brgy. Bagong Silang 7:00 PM; chased children.,Animal Control
"Manhole cover missing on National Hwy, Brgy. Bayanihan; water cannot drain properly after the thunderstorm. Sana ma-actionan agad.",Flooding
Open trench left by roadworks near bridge in Brgy. Sta. Cruz; no warning signs.,Road Damage
Fallen tree blocking Liberty St. in Brgy. Sta. Cruz tuwing malakas ang ulan; needs clearing team.,Disaster
Pack of stray dogs near evacuation center in Brgy. San Isidro 5:30 AM; chased children.,Animal Control
Open manhole on Sampaguita St. Brgy. Sta. Cruz near plaza; very dangerous at night.,Public Safety
"Illegal vendors blocking one lane on JP Laurel St., Brgy. Malinis; cars stuck and honking.",Traffic
Earthquake aftershocks reported; cracks seen at covered court Brgy. Pag-asa; request inspection.,Disaster
"Snatching incident reported on Liberty St., Brgy. Poblacion at 12:40 PM; CCTV in area should be checked.",Crime
Open trench left by roadworks near terminal in Brgy. Bagong Silang; no warning signs.,Road Damage
Forest/brush fire near Brgy. Bayanihan boundary; flames visible from National Hwy at 8:10 AM.,Fire
Drunk individuals harassing commuters near barangay hall Brgy. Bayanihan at 12:40 PM.,Crime
"Overflowing trash bins near the health center in Brgy. Pag-asa, Bonifacio Rd.. Foul smell yesterday; senior citizens complaining.",Garbage
Stray animals roaming near bridge in Brgy. San Isidro; risk of bites and rabies.,Health
Intermittent internet: disconnects every few minutes in Brgy. Bagong Silang especially at 8:10 AM.,Internet
"Knee-deep floodwater tuwing malakas ang ulan along Quezon Blvd., Brgy. Sta. Cruz. Drainage clogged with leaves and plastic.",Flooding
"Motorcycle with modified muffler keeps revving on Maharlika Rd., Brgy. Malinis every night. Pls respond asap.",Noise
Minor landslide/soil erosion near Brgy. Poblacion roadside on JP Laurel St. nung bagyo.,Disaster
Road shoulder collapsed near Brgy. Sta. Cruz along Mabini Ave. kahapon pagkatapos ng ulan; risk of accident. Need help ASAP.,Road Damage
Food stalls near bridge Brgy. New Era have uncovered food and flies; sanitation issue.,Health
"Knee-deep floodwater during drizzle along Mabini Ave., Brgy. Riverside. Drainage clogged with leaves and plastic. thank you.",Flooding
Community WiFi at terminal Brgy. Bagong Silang not working 3 days ago; router keeps rebooting. Pls respond asap.,Internet
Reported burglary at Rizal St. Brgy. Poblacion; window forced open since Monday.,Crime
Stray cats and dogs tearing garbage near health center Brgy. Bagong Silang; causes mess and smell.,Animal Control
Food stalls near health center Brgy. Bagong Silang have uncovered food and flies; sanitation issue.,Health
May nasusunog na basura/kanal near Quezon Blvd. Brgy. Riverside around 6:15 AM; strong odor and smoke.,Fire
May asong gala na nangagat sa Mabini Ave Brgy Bagong Silang since Monday; needs barangay action,Animal Control
"Streetlight not working on Sampaguita St., Brgy. Bayanihan; area is very dark at night. Sana ma-actionan agad.",Streetlight
Patay ang ilaw sa poste malapit sa elementary school Brgy. Bayanihan since 3 days ago.,Streetlight
"May tambak na basura sa kanto ng Del Pilar St., Brgy. Mabini. Hindi pa kinukuha yesterday. May daga na. thank you.",Garbage
Road shoulder collapsed near Brgy. San Isidro along National Hwy nung bagyo; risk of accident. 🚨,Road Damage
Grass fire reported near terminal in Brgy. Malinis 3 days ago; smoke reducing visibility on Sampaguita St..,Fire
"Overflowing trash bins near the chapel in Brgy. San Isidro, Rizal St.. Foul smell today; motorists complaining. Pls respond asap.",Garbage
Illegal dumping of mixed waste and construction debris beside the park at Brgy. San Isidro. 🔥,Garbage
May naghihinalang tao paikot-ikot near health center Brgy. Bagong Silang since Monday; residents feel unsafe.,Crime
Baha sa tapat ng plaza Brgy. Pag-asa at 7:00 PM; vehicles cannot pass safely.,Flooding
"Large pothole on National Hwy, Brgy. Bagong Silang; a motorcycle almost crashed today. Needs patching. 😷",Road Damage
"Motorcycle with modified muffler keeps revving on Maharlika Rd., Brgy. Riverside every night.",Noise
"Low water pressure on Maharlika Rd., Brgy. Pag-asa yesterday; tap only drips. Need help ASAP.",Water Supply
Broken footbridge/handrail near terminal Brgy. Mabini; risk of falling.,Public Safety
"May tambak na basura sa kanto ng National Hwy, Brgy. Bagong Silang. Hindi pa kinukuha yesterday. May daga na.",Garbage
Several streetlights out along Sampaguita St. in Brgy. San Isidro; please repair.,Streetlight
Bar music too loud near riverbank Brgy San Isidro; windows shaking,Noise
Internet connection down in Brgy. Poblacion since this morning; students can't attend online class.,Internet
"Illegal vendors blocking one lane on JP Laurel St., Brgy. Bagong Silang; cars stuck and honking.",Traffic
No water supply in Brgy. Malinis since 12:40 PM; residents cannot store water.,Water Supply
Blocked fire exit/escape route near riverbank Brgy. Bagong Silang; please enforce safety.,Public Safety
Uncollected garbage after market day near bridge in Brgy. Sta. Cruz; plastic scattered on the road.,Garbage
Evacuation center at park Brgy. Poblacion lacks supplies (water/blankets) for 1 week.,Disaster
Strong winds damaged roofs in Brgy. Bagong Silang last night; families need temporary shelter.,Disaster
"Snatching incident reported on Bonifacio Rd., Brgy. Poblacion at 6:15 AM; CCTV in area should be checked.",Crime
Someone is dumping wastewater/sewage on Mabini Ave. Brgy. Riverside; foul smell and slippery road.,Health
May nag-iinuman at sobrang ingay sa Sampaguita St. Brgy. Bayanihan hanggang 11:55 PM.,Noise
Baradong kanal sa National Hwy Brgy. Riverside; umaapaw nung bagyo and water enters houses.,Flooding
Kitchen fire at a stall near plaza Brgy. Riverside; needs inspection of LPG safety.,Fire
Strong winds damaged roofs in Brgy. Pag-asa since yesterday; families need temporary shelter.,Disaster
May bitak at lubak sa kalsada sa Bonifacio Rd. Brgy. Mabini; delikado lalo na pag gabi.,Road Damage
Open manhole on JP Laurel St. Brgy. San Isidro near health center; very dangerous at night.,Public Safety
Food stalls near public market Brgy. Poblacion have uncovered food and flies; sanitation issue.,Health
"Streetlight not working on Del Pilar St., Brgy. Bayanihan; area is very dark at night.",Streetlight
Blocked fire exit/escape route near bridge Brgy. New Era; please enforce safety.,Public Safety
Broken footbridge/handrail near park Brgy. Mabini; risk of falling. Sana ma-actionan agad.,Public Safety
Very slow mobile data signal near barangay hall Brgy. Malinis; calls dropping frequently.,Internet
May nag-iinuman at sobrang ingay sa Bonifacio Rd. Brgy. Riverside hanggang 8:10 AM. Need help ASAP.,Noise
"Possible dengue risk: standing water and many mosquitoes near park, Brgy San Isidro 3 days ago 😟",Health
Someone is dumping wastewater/sewage on Mabini Ave. Brgy. New Era; foul smell and slippery road.,Health
Uncovered well/pit near Brgy. Bagong Silang houses; children at risk.,Public Safety
Water leak from main pipe near terminal Brgy. Mabini; water wasted and road flooded.,Water Supply
Exposed electrical wire hanging near elementary school in Brgy. Poblacion; could electrocute someone.,Electricity
"Illegal vendors blocking one lane on Quezon Blvd., Brgy. Malinis; cars stuck and honking. Sana ma-actionan agad.",Traffic
Bar music too loud near barangay hall Brgy. Sta. Cruz; windows shaking.,Noise
Open trench left by roadworks near chapel in Brgy. Malinis; no warning signs.,Road Damage
"Overflowing trash bins near the evacuation center in Brgy Bagong Silang, Maharlika Rd Foul smell yesterday; senior citizens complaining",Garbage
Earthquake aftershocks reported; cracks seen at elementary school Brgy. New Era; request inspection. Sana ma-actionan agad.,Disaster
"Broken sidewalk tiles near evacuation center, Brgy. Poblacion; pedestrians keep tripping. 😟",Road Damage
Stray cats and dogs tearing garbage near covered court Brgy. Sta. Cruz; causes mess and smell.,Animal Control
"May tambak na basura sa kanto ng Rizal St., Brgy. Bagong Silang. Hindi pa kinukuha for 1 week. May daga na.",Garbage
Exposed electrical wire hanging near covered court in Brgy. Mabini; could electrocute someone.,Electricity
Snake spotted near shoreline Brgy. Sta. Cruz 3 days ago; residents scared.,Animal Control
Illegal dumping of mixed waste and construction debris beside the chapel at Brgy. Pag-asa.,Garbage
"Knee-deep floodwater tuwing malakas ang ulan along Del Pilar St., Brgy. Sta. Cruz. Drainage clogged with leaves and plastic.",Flooding
No water supply in Brgy. Malinis since 9:30 PM; residents cannot store water. Pls respond asap.,Water Supply
Evacuation center at health center Brgy. San Isidro lacks supplies (water/blankets) since yesterday.,Disaster
"Large pothole on Rizal St., Brgy. New Era; a motorcycle almost crashed yesterday. Needs patching. Need help ASAP.",Road Damage
