text,category
Fiber line hanging low across Mabini Ave. Brgy. New Era; trucks might hit it.,Internet
Blocked fire exit/escape route near health center Brgy. Bayanihan; please enforce safety. 😟,Public Safety
Open manhole on JP Laurel St. Brgy. Poblacion near plaza; very dangerous at night.,Public Safety
Grass fire reported near bridge in Brgy Pag-asa 3 days ago; smoke reducing visibility on Quezon Blvd,Fire
May nag-iinuman at sobrang ingay sa Sampaguita St. Brgy. San Isidro hanggang 12:40 PM. Sana ma-actionan agad.,Noise
Fiber line hanging low across Rizal St. Brgy. New Era; trucks might hit it.,Internet
Water leak from main pipe near elementary school Brgy. Malinis; water wasted and road flooded.,Water Supply
Baha sa tapat ng public market Brgy Sta Cruz at 4:25 PM; vehicles cannot pass safely thank you,Flooding
"May tambak na basura sa kanto ng Maharlika Rd, Brgy Sta Cruz Hindi pa kinukuha for 1 week May daga na",Garbage
Very slow mobile data signal near chapel Brgy San Isidro; calls dropping frequently,Internet
Baha sa tapat ng terminal Brgy. Poblacion at 4:25 PM; vehicles cannot pass safely. Sana ma-actionan agad.,Flooding
Intermittent internet: disconnects every few minutes in Brgy. Sta. Cruz especially at 4:25 PM. Sana ma-actionan agad.,Internet
Food stalls near elementary school Brgy. Malinis have uncovered food and flies; sanitation issue.,Health
Illegal dumping of mixed waste and construction debris beside the chapel at Brgy. Pag-asa.,Garbage
"Snatching incident reported on Quezon Blvd., Brgy. Riverside at 11:55 PM; CCTV in area should be checked.",Crime
"Overflowing trash bins near the barangay hall in Brgy. San Isidro, National Hwy. Foul smell this morning; children complaining. Pls respond asap.",Garbage
"Snatching incident reported on Rizal St., Brgy. Sta. Cruz at 5:30 AM; CCTV in area should be checked.",Crime
Earthquake aftershocks reported; cracks seen at barangay hall Brgy. Bagong Silang; request inspection.,Disaster
Water leak from main pipe near chapel Brgy. Sta. Cruz; water wasted and road flooded. 😟,Water Supply
Baradong kanal sa Sampaguita St. Brgy. Bayanihan; umaapaw during drizzle and water enters houses. Need help ASAP.,Flooding
"May nagsusunog ng basura near chapel, Brgy. Malinis around 5:30 AM; usok pumapasok sa bahay.",Garbage
Patay ang ilaw sa poste malapit sa covered court Brgy. Riverside since this morning.,Streetlight
Baha sa tapat ng health center Brgy. San Isidro at 7:00 PM; vehicles cannot pass safely.,Flooding
Forest/brush fire near Brgy New Era boundary; flames visible from Sampaguita St at 11:55 PM Need help ASAP,Fire
Patay ang ilaw sa poste malapit sa riverbank Brgy. San Isidro since since yesterday.,Streetlight
Flickering streetlight at National Hwy Brgy. Bagong Silang; safety concern for children.,Streetlight
Strong winds damaged roofs in Brgy. San Isidro last night; families need temporary shelter. Pls respond asap.,Disaster
Fallen tree blocking Mabini Ave. in Brgy. Mabini kahapon pagkatapos ng ulan; needs clearing team. thank you.,Disaster
Several streetlights out along Quezon Blvd. in Brgy. Pag-asa; please repair.,Streetlight
Fiber line hanging low across Bonifacio Rd. Brgy. Malinis; trucks might hit it.,Internet
May asong gala na nangagat sa Quezon Blvd. Brgy. Poblacion for 1 week; needs barangay action.,Animal Control
Water interruption happens every morning in Brgy. New Era; need schedule/notice.,Water Supply
Transformer humming loudly and smells burnt near Del Pilar St. Brgy. Pag-asa; possible overload.,Electricity
Illegal dumping of mixed waste and construction debris beside the chapel at Brgy Malinis,Garbage
No traffic enforcer at intersection of Maharlika Rd. in Brgy. Bagong Silang; near-misses happening.,Traffic
"Streetlight not working on JP Laurel St., Brgy. Bayanihan; area is very dark at night. Pls respond asap. 🙏",Streetlight
"May nagsusunog ng basura near plaza, Brgy. Sta. Cruz around 9:30 PM; usok pumapasok sa bahay.",Garbage
Open trench left by roadworks near elementary school in Brgy. Bagong Silang; no warning signs.,Road Damage
Fiber line hanging low across Mabini Ave. Brgy. Mabini; trucks might hit it. 🚨,Internet
Intermittent internet: disconnects every few minutes in Brgy. Malinis especially at 8:10 AM. Sana ma-actionan agad.,Internet
Patay ang ilaw sa poste malapit sa terminal Brgy. Bagong Silang since this morning. thank you.,Streetlight
Motorcycle theft attempt near bridge in Brgy. New Era last night; please increase patrol. Pls respond asap.,Crime
May asong gala na nangagat sa Maharlika Rd. Brgy. Bayanihan yesterday; needs barangay action.,Animal Control
Uncollected garbage after market day near elementary school in Brgy. Malinis; plastic scattered on the road.,Garbage
"Low water pressure on Rizal St., Brgy. San Isidro this morning; tap only drips.",Water Supply
No water supply in Brgy. Mabini since 8:10 AM; residents cannot store water.,Water Supply
"Illegal vendors blocking one lane on Maharlika Rd., Brgy. Sta. Cruz; cars stuck and honking.",Traffic
Drunk individuals harassing commuters near barangay hall Brgy. Malinis at 9:30 PM. Sana ma-actionan agad.,Crime
Heavy traffic due to double parking near public market in Brgy. Mabini at 6:15 AM.,Traffic
Flickering streetlight at JP Laurel St. Brgy. Malinis; safety concern for commuters.,Streetlight
Stray cats and dogs tearing garbage near health center Brgy Sta Cruz; causes mess and smell,Animal Control
Broken footbridge/handrail near terminal Brgy Riverside; risk of falling,Public Safety
Transformer humming loudly and smells burnt near Liberty St. Brgy. Bayanihan; possible overload. Sana ma-actionan agad.,Electricity
Patay ang ilaw sa poste malapit sa terminal Brgy. Sta. Cruz since yesterday.,Streetlight
Very slow mobile data signal near riverbank Brgy. New Era; calls dropping frequently.,Internet
Illegal dumping of mixed waste and construction debris beside the elementary school at Brgy Riverside Sana ma-actionan agad,Garbage
Stray animals roaming near health center in Brgy. Malinis; risk of bites and rabies.,Health
Stray cats and dogs tearing garbage near riverbank Brgy. Bayanihan; causes mess and smell.,Animal Control
Strong winds damaged roofs in Brgy. New Era since yesterday; families need temporary shelter.,Disaster
Loose hanging cables across Mabini Ave. Brgy. San Isidro; could snag vehicles.,Public Safety
Faded pedestrian crossing near terminal Brgy. Sta. Cruz; drivers don't slow down.,Traffic
Minor landslide/soil erosion near Brgy. Bayanihan roadside on JP Laurel St. during drizzle.,Disaster
Intermittent internet: disconnects every few minutes in Brgy. Malinis especially at 12:40 PM.,Internet
Fiber line hanging low across Quezon Blvd. Brgy. New Era; trucks might hit it.,Internet
Stray animals roaming near bridge in Brgy. Sta. Cruz; risk of bites and rabies.,Health
Heavy traffic due to double parking near elementary school in Brgy. San Isidro at 11:55 PM.,Traffic
"Knee-deep floodwater after heavy rain along Rizal St., Brgy. Malinis. Drainage clogged with leaves and plastic. thank you.",Flooding
Loose hanging cables across Sampaguita St. Brgy. Bagong Silang; could snag vehicles.,Public Safety
"May tambak na basura sa kanto ng JP Laurel St., Brgy. Riverside. Hindi pa kinukuha 3 days ago. May daga na.",Garbage
"May tambak na basura sa kanto ng Maharlika Rd., Brgy. Bagong Silang. Hindi pa kinukuha for 1 week. May daga na.",Garbage
"May nagsusunog ng basura near park, Brgy. San Isidro around 12:40 PM; usok pumapasok sa bahay.",Garbage
Grass fire reported near plaza in Brgy. Bayanihan today; smoke reducing visibility on JP Laurel St..,Fire
May asong gala na nangagat sa Liberty St. Brgy. New Era since Monday; needs barangay action.,Animal Control
Fiber line hanging low across Del Pilar St. Brgy. Bayanihan; trucks might hit it.,Internet
"Possible dengue risk: standing water and many mosquitoes near chapel, Brgy. Bayanihan yesterday.",Health
Power outage in Brgy. New Era since 11:55 PM; households cannot use appliances. Sana ma-actionan agad.,Electricity
Drunk individuals harassing commuters near park Brgy Mabini at 9:30 PM thank you,Crime
Internet connection down in Brgy. Bagong Silang since today; students can't attend online class. Pls respond asap.,Internet
Uncollected garbage after market day near terminal in Brgy. New Era; plastic scattered on the road. 😟,Garbage
May naghihinalang tao paikot-ikot near elementary school Brgy. Riverside today; residents feel unsafe.,Crime
Several streetlights out along JP Laurel St. in Brgy. Bagong Silang; please repair.,Streetlight
"Illegal vendors blocking one lane on Bonifacio Rd., Brgy. Pag-asa; cars stuck and honking.",Traffic
Very slow mobile data signal near bridge Brgy. Pag-asa; calls dropping frequently.,Internet
Reported suspected food poisoning after eating at evacuation center Brgy. Riverside last night; several students got sick. Need help ASAP.,Health
Faded pedestrian crossing near covered court Brgy. New Era; drivers don't slow down.,Traffic
Minor landslide/soil erosion near Brgy. San Isidro roadside on Bonifacio Rd. tuwing malakas ang ulan.,Disaster
"Illegal vendors blocking one lane on Mabini Ave., Brgy. Bagong Silang; cars stuck and honking. thank you.",Traffic
Open manhole on Del Pilar St. Brgy. Bayanihan near terminal; very dangerous at night.,Public Safety
Minor landslide/soil erosion near Brgy. Pag-asa roadside on JP Laurel St. kahapon pagkatapos ng ulan.,Disaster
Reported burglary at Sampaguita St. Brgy. Bayanihan; window forced open for 1 week.,Crime
Several streetlights out along Bonifacio Rd. in Brgy. San Isidro; please repair.,Streetlight
Evacuation center at covered court Brgy. New Era lacks supplies (water/blankets) today.,Disaster
Earthquake aftershocks reported; cracks seen at terminal Brgy Bagong Silang; request inspection,Disaster
"Power pole leaning dangerously on Rizal St., Brgy. San Isidro; might fall kahapon pagkatapos ng ulan. 🚨",Electricity
Dead animal (dog/cat) on Rizal St. Brgy. Sta. Cruz; needs proper disposal to avoid disease.,Animal Control
"Broken sidewalk tiles near evacuation center, Brgy. Poblacion; pedestrians keep tripping.",Road Damage
Frequent voltage fluctuation/brownout in Brgy. San Isidro yesterday; lights flicker.,Electricity
Exposed electrical wire hanging near park in Brgy. Malinis; could electrocute someone.,Electricity
Stray animals roaming near bridge in Brgy. San Isidro; risk of bites and rabies. thank you.,Health
Baradong kanal sa Bonifacio Rd. Brgy. Poblacion; umaapaw during drizzle and water enters houses. 🚨,Flooding
Broken footbridge/handrail near riverbank Brgy. New Era; risk of falling. Pls respond asap.,Public Safety
Water leak from main pipe near riverbank Brgy. Bagong Silang; water wasted and road flooded.,Water Supply
Broken footbridge/handrail near riverbank Brgy Riverside; risk of falling,Public Safety
Open manhole on JP Laurel St. Brgy. Bayanihan near chapel; very dangerous at night.,Public Safety
Earthquake aftershocks reported; cracks seen at elementary school Brgy. Bayanihan; request inspection. Pls respond asap.,Disaster
Tap water is brown/muddy in Brgy. Malinis yesterday; possible pipe contamination.,Water Supply
Forest/brush fire near Brgy. New Era boundary; flames visible from National Hwy at 7:00 PM.,Fire
Transformer humming loudly and smells burnt near Quezon Blvd. Brgy. Mabini; possible overload.,Electricity
Tap water is brown/muddy in Brgy. Pag-asa since Monday; possible pipe contamination.,Water Supply
Uncollected garbage after market day near bridge in Brgy. Sta. Cruz; plastic scattered on the road.,Garbage
Loud karaoke in Brgy. New Era near elementary school past 6:15 AM; kids can't sleep.,Noise
"Low water pressure on Rizal St., Brgy. Bayanihan last night; tap only drips.",Water Supply
Frequent voltage fluctuation/brownout in Brgy. Malinis since yesterday; lights flicker. 🙏,Electricity
Motorcycle theft attempt near public market in Brgy. Bagong Silang last night; please increase patrol. Pls respond asap.,Crime
Uncovered well/pit near Brgy. Sta. Cruz houses; children at risk.,Public Safety
Pack of stray dogs near park in Brgy. San Isidro 9:30 PM; chased children.,Animal Control
Baradong kanal sa Sampaguita St. Brgy. New Era; umaapaw tuwing malakas ang ulan and water enters houses.,Flooding
No water supply in Brgy Mabini since 11:55 PM; residents cannot store water Sana ma-actionan agad,Water Supply
Baha sa tapat ng public market Brgy. San Isidro at 8:10 AM; vehicles cannot pass safely.,Flooding
Broken lamp cover at Brgy. Riverside near plaza; bulb exposed and could shatter.,Streetlight
May bitak at lubak sa kalsada sa Quezon Blvd. Brgy. Bagong Silang; delikado lalo na pag gabi. 🔥,Road Damage
"Electrical sparks seen then small fire on pole near terminal, Brgy. Pag-asa kahapon pagkatapos ng ulan. thank you.",Fire
Water leak from main pipe near barangay hall Brgy. Sta. Cruz; water wasted and road flooded.,Water Supply
Exposed electrical wire hanging near elementary school in Brgy. Mabini; could electrocute someone.,Electricity
May bitak at lubak sa kalsada sa Rizal St. Brgy. Pag-asa; delikado lalo na pag gabi. thank you.,Road Damage
No traffic enforcer at intersection of Maharlika Rd. in Brgy. Mabini; near-misses happening.,Traffic
Tap water is brown/muddy in Brgy. Bayanihan last night; possible pipe contamination.,Water Supply
Patay ang ilaw sa poste malapit sa health center Brgy. New Era since yesterday.,Streetlight
Pack of stray dogs near bridge in Brgy. Riverside 11:55 PM; chased children. thank you.,Animal Control
Flickering streetlight at Mabini Ave. Brgy. San Isidro; safety concern for vendors.,Streetlight
Stray cats and dogs tearing garbage near covered court Brgy. New Era; causes mess and smell. Pls respond asap.,Animal Control
Exposed electrical wire hanging near plaza in Brgy. Poblacion; could electrocute someone. 🔥,Electricity
Frequent voltage fluctuation/brownout in Brgy. Malinis since yesterday; lights flicker. Pls respond asap.,Electricity
"Large pothole on Bonifacio Rd., Brgy. Mabini; a motorcycle almost crashed today. Needs patching.",Road Damage
"Electrical sparks seen then small fire on pole near chapel, Brgy. San Isidro kahapon pagkatapos ng ulan.",Fire
Flickering streetlight at Rizal St. Brgy. San Isidro; safety concern for residents. Sana ma-actionan agad.,Streetlight
Water interruption happens every morning in Brgy. Pag-asa; need schedule/notice.,Water Supply
Someone is dumping wastewater/sewage on Mabini Ave. Brgy. New Era; foul smell and slippery road.,Health
Intermittent internet: disconnects every few minutes in Brgy. New Era especially at 4:25 PM.,Internet
Strong winds damaged roofs in Brgy. Pag-asa last night; families need temporary shelter. 🙏,Disaster
Uncollected garbage after market day near park in Brgy. Bayanihan; plastic scattered on the road.,Garbage
Open trench left by roadworks near park in Brgy. New Era; no warning signs.,Road Damage
No water supply in Brgy. Riverside since 12:40 PM; residents cannot store water.,Water Supply
Strong winds damaged roofs in Brgy. San Isidro 3 days ago; families need temporary shelter.,Disaster
"Illegal vendors blocking one lane on Mabini Ave., Brgy. New Era; cars stuck and honking.",Traffic
May nag-iinuman at sobrang ingay sa JP Laurel St. Brgy. Bayanihan hanggang 8:10 AM. Sana ma-actionan agad.,Noise
Power outage in Brgy. Riverside since 11:55 PM; households cannot use appliances.,Electricity
Dead animal (dog/cat) on National Hwy Brgy. New Era; needs proper disposal to avoid disease. 😷,Animal Control
Snake spotted near creek Brgy. Riverside 3 days ago; residents scared.,Animal Control
Food stalls near elementary school Brgy. Mabini have uncovered food and flies; sanitation issue. Pls respond asap.,Health
Reported suspected food poisoning after eating at terminal Brgy. Sta. Cruz 3 days ago; several senior citizens got sick.,Health
"Overflowing trash bins near the bridge in Brgy. Pag-asa, Quezon Blvd.. Foul smell last night; vendors complaining.",Garbage
Pack of stray dogs near park in Brgy. Bagong Silang 7:00 PM; chased children. 😷,Animal Control
"Illegal vendors blocking one lane on JP Laurel St., Brgy. Pag-asa; cars stuck and honking. Need help ASAP.",Traffic
Road shoulder collapsed near Brgy. Malinis along Mabini Ave. during drizzle; risk of accident.,Road Damage
Transformer humming loudly and smells burnt near Liberty St. Brgy. Poblacion; possible overload.,Electricity
Very slow mobile data signal near public market Brgy. Sta. Cruz; calls dropping frequently.,Internet
"Tricycles loading/unloading in the middle of Rizal St., Brgy. Poblacion; causes congestion.",Traffic
Broken footbridge/handrail near covered court Brgy Malinis; risk of falling Need help ASAP,Public Safety
Food stalls near health center Brgy. Sta. Cruz have uncovered food and flies; sanitation issue. Sana ma-actionan agad.,Health
"Streetlight not working on National Hwy, Brgy. Riverside; area is very dark at night.",Streetlight
Faded pedestrian crossing near plaza Brgy. Riverside; drivers don't slow down.,Traffic
"Tricycles loading/unloading in the middle of Rizal St., Brgy. Malinis; causes congestion.",Traffic
"Low water pressure on Del Pilar St., Brgy. Poblacion yesterday; tap only drips. thank you.",Water Supply
Someone is dumping wastewater/sewage on Maharlika Rd. Brgy. Sta. Cruz; foul smell and slippery road.,Health
Power outage in Brgy. San Isidro since 11:55 PM; households cannot use appliances.,Electricity
"Knee-deep floodwater kahapon pagkatapos ng ulan along Sampaguita St., Brgy. Sta. Cruz. Drainage clogged with leaves and plastic. Pls respond asap.",Flooding
Fallen tree blocking Sampaguita St. in Brgy. Pag-asa kahapon pagkatapos ng ulan; needs clearing team. Sana ma-actionan agad.,Disaster
"Large pothole on Mabini Ave., Brgy. Mabini; a motorcycle almost crashed since Monday. Needs patching.",Road Damage
Water leak from main pipe near elementary school Brgy. Mabini; water wasted and road flooded. Sana ma-actionan agad.,Water Supply
May naghihinalang tao paikot-ikot near bridge Brgy. Bagong Silang last night; residents feel unsafe.,Crime
Patay ang ilaw sa poste malapit sa terminal Brgy. Sta. Cruz since this morning. thank you.,Streetlight
Transformer humming loudly and smells burnt near Bonifacio Rd. Brgy. Mabini; possible overload.,Electricity
Loud karaoke in Brgy. Riverside near chapel past 7:00 PM; kids can't sleep.,Noise
May nag-iinuman at sobrang ingay sa Liberty St. Brgy. Pag-asa hanggang 5:30 AM.,Noise
"Standing water in front of barangay hall, Brgy. Sta. Cruz this morning; possible mosquito breeding.",Flooding
Heavy traffic due to double parking near evacuation center in Brgy. Bagong Silang at 6:15 AM.,Traffic
Open trench left by roadworks near barangay hall in Brgy. Sta. Cruz; no warning signs.,Road Damage
"Large pothole on Liberty St., Brgy. Mabini; a motorcycle almost crashed yesterday. Needs patching.",Road Damage
Uncovered well/pit near Brgy. San Isidro houses; children at risk.,Public Safety
"Construction drilling starts at 11:55 PM in Brgy. Pag-asa, Rizal St.; violates quiet hours.",Noise
Motorcycle theft attempt near health center in Brgy. Poblacion last night; please increase patrol.,Crime
"Streetlight not working on National Hwy, Brgy. New Era; area is very dark at night.",Streetlight
No water supply in Brgy. Bayanihan since 11:55 PM; residents cannot store water.,Water Supply
Food stalls near barangay hall Brgy. Bagong Silang have uncovered food and flies; sanitation issue.,Health
Bar music too loud near evacuation center Brgy. Riverside; windows shaking.,Noise
Community WiFi at park Brgy. Riverside not working since yesterday; router keeps rebooting. Sana ma-actionan agad.,Internet
"Electrical sparks seen then small fire on pole near public market, Brgy. Pag-asa during drizzle.",Fire
Road shoulder collapsed near Brgy. Sta. Cruz along Liberty St. tuwing malakas ang ulan; risk of accident.,Road Damage
Baradong kanal sa JP Laurel St. Brgy. Bayanihan; umaapaw nung bagyo and water enters houses. Need help ASAP.,Flooding
May nasusunog na basura/kanal near National Hwy Brgy. Pag-asa around 9:30 PM; strong odor and smoke.,Fire
"Large pothole on Liberty St., Brgy. San Isidro; a motorcycle almost crashed since Monday. Needs patching.",Road Damage
Pack of stray dogs near public market in Brgy. Poblacion 8:10 AM; chased children.,Animal Control
"May nagsusunog ng basura near evacuation center, Brgy. Poblacion around 6:15 AM; usok pumapasok sa bahay.",Garbage
Baha sa tapat ng elementary school Brgy. Sta. Cruz at 12:40 PM; vehicles cannot pass safely.,Flooding
Reported burglary at Quezon Blvd Brgy Poblacion; window forced open last night,Crime
"Standing water in front of public market, Brgy. Bayanihan today; possible mosquito breeding.",Flooding
May bitak at lubak sa kalsada sa Sampaguita St. Brgy. Malinis; delikado lalo na pag gabi. Need help ASAP.,Road Damage
Drunk individuals harassing commuters near terminal Brgy. Malinis at 6:15 AM. Need help ASAP.,Crime
Loud karaoke in Brgy. San Isidro near terminal past 7:00 PM; kids can't sleep.,Noise
Minor landslide/soil erosion near Brgy. Mabini roadside on Sampaguita St. after the thunderstorm.,Disaster
Community WiFi at riverbank Brgy. San Isidro not working last night; router keeps rebooting.,Internet
Reported suspected food poisoning after eating at covered court Brgy. Pag-asa this morning; several children got sick. thank you.,Health
"Standing water in front of elementary school, Brgy. Poblacion 3 days ago; possible mosquito breeding. Pls respond asap. 🙏",Flooding
Several streetlights out along National Hwy in Brgy. San Isidro; please repair.,Streetlight
Blocked fire exit/escape route near barangay hall Brgy. Sta. Cruz; please enforce safety.,Public Safety
Community WiFi at barangay hall Brgy. Malinis not working last night; router keeps rebooting. 🚨,Internet
Patay ang ilaw sa poste malapit sa public market Brgy. Malinis since since Monday.,Streetlight
"May tambak na basura sa kanto ng Rizal St., Brgy. Bagong Silang. Hindi pa kinukuha this morning. May daga na. 🔥",Garbage
"Low water pressure on Sampaguita St, Brgy Sta Cruz today; tap only drips",Water Supply
Open manhole on Maharlika Rd. Brgy. Sta. Cruz near covered court; very dangerous at night.,Public Safety
Baha sa tapat ng riverbank Brgy. Mabini at 4:25 PM; vehicles cannot pass safely. Sana ma-actionan agad.,Flooding
Illegal dumping of mixed waste and construction debris beside the bridge at Brgy. Malinis.,Garbage
Illegal dumping of mixed waste and construction debris beside the terminal at Brgy. Sta. Cruz.,Garbage
Snake spotted near shoreline Brgy. San Isidro last night; residents scared.,Animal Control
May nag-iinuman at sobrang ingay sa Rizal St. Brgy. Bayanihan hanggang 8:10 AM.,Noise
Drunk individuals harassing commuters near chapel Brgy. New Era at 8:10 AM. Need help ASAP.,Crime
Minor landslide/soil erosion near Brgy. Malinis roadside on Rizal St. after the thunderstorm. 🔥,Disaster
"Electrical sparks seen then small fire on pole near bridge, Brgy. Pag-asa after heavy rain.",Fire
Strong winds damaged roofs in Brgy. Riverside for 1 week; families need temporary shelter.,Disaster
"Snatching incident reported on Rizal St., Brgy. Mabini at 4:25 PM; CCTV in area should be checked. 🔥",Crime
"Low water pressure on JP Laurel St., Brgy. Sta. Cruz since yesterday; tap only drips.",Water Supply
Heavy traffic due to double parking near plaza in Brgy. Riverside at 7:00 PM. Need help ASAP.,Traffic
Baradong kanal sa Sampaguita St. Brgy. Poblacion; umaapaw tuwing malakas ang ulan and water enters houses.,Flooding
Minor landslide/soil erosion near Brgy. Riverside roadside on Mabini Ave. after the thunderstorm. Sana ma-actionan agad.,Disaster
Broken footbridge/handrail near health center Brgy. New Era; risk of falling.,Public Safety
Illegal dumping of mixed waste and construction debris beside the covered court at Brgy. Malinis.,Garbage
Loose hanging cables across Del Pilar St. Brgy. Riverside; could snag vehicles.,Public Safety
Faded pedestrian crossing near plaza Brgy. Bayanihan; drivers don't slow down.,Traffic
Loose hanging cables across Mabini Ave. Brgy. Pag-asa; could snag vehicles.,Public Safety
Stray cats and dogs tearing garbage near public market Brgy. Bayanihan; causes mess and smell.,Animal Control
"May nagsusunog ng basura near health center, Brgy. San Isidro around 11:55 PM; usok pumapasok sa bahay.",Garbage
Illegal dumping of mixed waste and construction debris beside the chapel at Brgy. San Isidro.,Garbage
"Broken sidewalk tiles near terminal, Brgy. Bayanihan; pedestrians keep tripping.",Road Damage
"Electrical sparks seen then small fire on pole near health center, Brgy. Riverside after heavy rain.",Fire
Someone is dumping wastewater/sewage on Rizal St. Brgy. Poblacion; foul smell and slippery road.,Health
Water interruption happens every morning in Brgy. Bagong Silang; need schedule/notice.,Water Supply
Strong winds damaged roofs in Brgy. Bayanihan since Monday; families need temporary shelter.,Disaster
May bitak at lubak sa kalsada sa National Hwy Brgy. New Era; delikado lalo na pag gabi. 🙏,Road Damage
May nasusunog na basura/kanal near Liberty St. Brgy. Sta. Cruz around 7:00 PM; strong odor and smoke.,Fire
"May nagsusunog ng basura near elementary school, Brgy. Bayanihan around 4:25 PM; usok pumapasok sa bahay.",Garbage
"Standing water in front of terminal, Brgy. Riverside since Monday; possible mosquito breeding.",Flooding
May asong gala na nangagat sa Bonifacio Rd Brgy Mabini this morning; needs barangay action,Animal Control
Drunk individuals harassing commuters near covered court Brgy. Bayanihan at 5:30 AM.,Crime
Stray cats and dogs tearing garbage near terminal Brgy. Poblacion; causes mess and smell.,Animal Control
"Overflowing trash bins near the evacuation center in Brgy. Pag-asa, Rizal St.. Foul smell today; residents complaining.",Garbage
